id,sku,desc,qty,photo,details
1,IPH01,iPhone,200,iphone.jpg,The iPhone is a multimedia enabled smartphone designed and marketed by Apple Inc.  It's the first phone to feature multi-touch and a full html browser
2,IPH02,iPhone 3Gs,150,iphone3gs.jpg,"iPhone 3GS is a GSM cell phone that's also an iPod, a video camera, and a mobile Internet device with email and GPS maps. "
3,RIMB,BlackBerry Bold,160,blackberry.jpg,The Blackberry is a smartphone that's marketed by RIM. Blackberry provides the full smartphone experience with everything you need in a mobile phone.
4,DRO1,Motorola Driod,145,droid.jpg,The Motorola Droid is an Android-based smartphone by Motorola distributed by Verizon Wireless in the United States. 
5,HTC01,HTC Hero,260,htc.jpg,HTC Tattoo is the first phone that can be customized inside and out.  You cam personalise you phone with great apps from the Android Marketplace
